{
    "URL": "https://androidx2-perf.skia.org",
    "contact": "http://go/androidx-discuss",
    "feedback_url": "https://issuetracker.google.com/issues/new?component=1547614&template=1970127",
    "trace_sample_proportion": 0.2,
    "notify_config": {
        "notifications": "markdown_issuetracker",
        "issue_tracker_api_key_secret_project": "skia-infra-public",
        "issue_tracker_api_key_secret_name": "perf-issue-tracker-apikey",
        "subject": "{{ .Alert.DisplayName }} - Regression found between {{ buildIDFromSubject .PreviousCommit.Subject }} and {{ buildIDFromSubject .Commit.Subject }}",
        "body": [
            "Perf Regression ({{ .Cluster.StepFit.Status }}) found, matching {{ .Cluster.Num }} tracked metrics from benchmarks.",
            "",
            "To triage this regression, see the guide at [go/androidx-bench-triage](http://go/androidx-bench-triage).",
            "",
            "* [Graph on dashboard]({{ .ViewOnDashboard }})",
            "* [Alert details]({{ .URL }}/g/t/{{ .Commit.GitHash }})",
            "* [CLs in build range ({{ buildIDFromSubject .PreviousCommit.Subject }} through {{ buildIDFromSubject .Commit.Subject }}\\]](https://android-build.corp.google.com/{{ buildIDFromSubject .Commit.Subject }}/branches/aosp-androidx-main/targets/androidx/cls?end={{ buildIDFromSubject .PreviousCommit.Subject }})",
            "* [{{ .Alert.DisplayName }} alert config]({{ .URL }}/a/?{{ .Alert.IDAsString }})",
            "",
            "Tests affected:",
            "```",
            "{{ range index .ParamSet \"test\" }} {{ . }}",
            "{{end}}```",
            "",
            "Devices affected:",
            "```",
            "{{ range index .ParamSet \"device_name\" }} {{ . }}",
            "{{end}}```",
            "API Level:",
            "```",
            "{{ range index .ParamSet \"sdk_release_name\" }} {{ . }}",
            "{{end}}```",
            ""
        ]
    },
    "auth_config": {
        "header_name": "X-WEBAUTH-USER"
    },
    "data_store_config": {
        "datastore_type": "cockroachdb",
        "connection_string": "postgresql://root@perf-cockroachdb-public:26257/androidx?sslmode=disable",
        "tile_size": 8192
    },
    "ingestion_config": {
        "source_config": {
            "source_type": "gcs",
            "project": "skia-public",
            "topic": "perf-ingestion-android2-production",
            "subscription": "perf-ingestion-android2-production-prod",
            "sources": [
                "gs://android-perf-2/android2"
            ]
        },
        "branches": [],
        "file_ingestion_pubsub_topic_name": ""
    },
    "git_repo_config": {
        "provider": "gitiles",
        "url": "https://android.googlesource.com/platform/superproject",
        "dir": "/tmp/androidx",
        "debounce_commit_url": false,
        "branch": "androidx-main",
        "start_commit": "5f8b9aa0feafff7548336998a17723cb792cdb53"
    },
    "anomaly_config": {
        "settling_time": "5h"
    }
}