{
    "URL": "https://chrome-perf.corp.goog",
    "ga_measurement_id": "G-LEQSJH1GXP",
    "allowed_hosts": [],
    "backend_host_url": "perf-be-chrome-non-public.perf.svc.cluster.local:8000",
    "contact": "browser-perf-engprod@google.com",
    "trace_sample_proportion": 1.0,
    "invalid_param_char_regex": "([^a-zA-Z0-9!~@#$%^&*()+ :\\._\\-])",
    "fetch_chrome_perf_anomalies": true,
    "use_regression2_schema": true,
    "bug_host_url": "https://issues.chromium.org",
    "feedback_url": "http://go/berf-skia-feedback",
    "chat_url": "http://go/berf-skia-chat",
    "filter_parent_traces": true,
    "notify_config": {
        "notifications": "chromeperf"
    },
    "culprit_notify_config": {
        "notifications": "markdown_issuetracker",
        "issue_tracker_api_key_secret_project": "skia-infra-public",
        "issue_tracker_api_key_secret_name": "perf-issue-tracker-apikey"
    },
    "auth_config": {
        "header_name": "X-WEBAUTH-USER"
    },
    "data_store_config": {
        "datastore_type": "cockroachdb",
        "connection_string": "postgresql://root@perf-cockroachdb-public:26257/chrome_int?sslmode=disable",
        "tile_size": 8192,
        "enable_follower_reads": true
    },
    "ingestion_config": {
        "source_config": {
            "source_type": "gcs",
            "project": "skia-public",
            "topic": "perf-ingestion-chrome-non-public",
            "subscription": "perf-ingestion-chrome-non-public-prod",
            "dl_topic": "perf-ingestion-chrome-non-public-dl",
            "dl_subscription": "perf-ingestion-chrome-non-public-dl-prod",
            "sources": [
                "gs://chrome-perf-non-public/ingest"
            ]
        },
        "branches": [],
        "file_ingestion_pubsub_topic_name": ""
    },
    "git_repo_config": {
        "provider": "gitiles",
        "url": "https://chromium.googlesource.com/chromium/src",
        "dir": "/tmp/checkout",
        "debounce_commit_url": false,
        "file_change_marker": "",
        "start_commit": "b7fa4587f55a066e97f79b4c97ed785dc217064b",
        "commit_number_regex": "Cr-Commit-Position: refs/heads/(main|master)@\\{#(.*)\\}"
    },
    "query_config": {
        "include_params": [
            "benchmark",
            "bot",
            "test",
            "subtest_1",
            "subtest_2",
            "subtest_3"
        ],
        "default_param_selections": {
            "stat": ["value"]
        },
        "default_url_values": {
            "summary": "true"
        },
        "redis_config": {
            "project": "skia-infra-corp",
            "zone": "us-central1",
            "instance": "skia-query"
        }
    },
    "help_url_override": "http://go/chrome-perf-user-doc",
    "trace_format": "chrome",
    "need_alert_action": true
}